{
  "catalog_version": 2,
  "units": "mm",
  "semantics": "Hardware profiles are one-time editable patches of canonical cabinet/drawer settings. The geometry engine never resolves a persistent hardware profile ID.",
  "profiles": [
    {
      "id": "generic_side_mount_12_7_450",
      "category": "drawer_slide",
      "manufacturer": "Generic",
      "family": "Side-mount ball-bearing",
      "model": "450 mm / 12.7 mm clearance",
      "label": "Generic side-mount 450 mm",
      "targets": [
        "utility",
        "shop_cart",
        "benchtop",
        "stackable",
        "kitchen",
        "drawer"
      ],
      "verification": {
        "status": "reference",
        "verified": false,
        "notes": "Project reference profile; verify actual hardware before machining."
      },
      "apply": {
        "drawer_mount": "metal_slides",
        "metal_slide_clearance_per_side": 12.7,
        "metal_slide_length": 450,
        "metal_slide_front_setback": 3,
        "metal_slide_envelope_height": 45,
        "include_metal_slide_holes": true,
        "metal_slide_hole_pattern_mode": "explicit_array",
        "hardware_drilling_mode": "recommended",
        "metal_slide_cabinet_holes_x": [
          37,
          133,
          229,
          325
        ],
        "metal_slide_drawer_holes_x": [
          37,
          133,
          229,
          325
        ],
        "metal_slide_cabinet_hole_diameter": 5,
        "metal_slide_drawer_hole_diameter": 5,
        "metal_slide_hole_rear_margin": 20,
        "metal_slide_cabinet_hole_z_from_drawer_bottom": 22.5,
        "metal_slide_drawer_hole_z_from_drawer_bottom": 22.5
      },
      "source": {
        "type": "project_reference",
        "title": "Modular Storage generic side-mount baseline"
      }
    },
    {
      "id": "generic_side_mount_12_7_500",
      "extends": "generic_side_mount_12_7_450",
      "label": "Generic side-mount 500 mm",
      "model": "500 mm / 12.7 mm clearance",
      "apply": {
        "metal_slide_length": 500,
        "metal_slide_cabinet_holes_x": [
          37,
          133,
          229,
          325,
          421
        ],
        "metal_slide_drawer_holes_x": [
          37,
          133,
          229,
          325,
          421
        ]
      }
    },
    {
      "id": "accuride_3832e_450",
      "category": "drawer_slide",
      "manufacturer": "Accuride",
      "family": "3832E",
      "model": "3832-E18",
      "label": "Accuride 3832E 450 mm",
      "targets": [
        "utility",
        "shop_cart",
        "benchtop",
        "stackable",
        "kitchen",
        "drawer"
      ],
      "verification": {
        "status": "manufacturer_partial",
        "verified": true,
        "notes": "Manufacturer-verified length, 12.7 mm side space and 45.7 mm height. Automatic drilling is intentionally disabled because the rail offers multiple mounting-hole/slot choices."
      },
      "apply": {
        "drawer_mount": "metal_slides",
        "metal_slide_clearance_per_side": 12.7,
        "metal_slide_length": 450,
        "metal_slide_front_setback": 0,
        "metal_slide_envelope_height": 45.7,
        "include_metal_slide_holes": false,
        "metal_slide_hole_pattern_mode": "legacy_spacing"
      },
      "source": {
        "type": "manufacturer_pdf",
        "manufacturer": "Accuride",
        "title": "MODEL 3832E, 3834E technical sheet",
        "url": "https://www.accuride.com/media/amasty/amfile/attach/516dd0135bf3d6a5f7d76cafd3f74da0.pdf",
        "retrieved": "2026-09-15"
      }
    },
    {
      "id": "accuride_3832e_500",
      "extends": "accuride_3832e_450",
      "label": "Accuride 3832E 500 mm",
      "model": "3832-E20",
      "apply": {
        "metal_slide_length": 500
      }
    },
    {
      "id": "kv_8400_18in",
      "category": "drawer_slide",
      "manufacturer": "Knape & Vogt",
      "family": "8400",
      "model": "8400 18 in",
      "label": "KV 8400 18 in (457.2 mm)",
      "targets": [
        "utility",
        "shop_cart",
        "benchtop",
        "stackable",
        "kitchen",
        "drawer"
      ],
      "verification": {
        "status": "manufacturer_partial",
        "verified": true,
        "notes": "Manufacturer documents verify 12.7 mm minimum side clearance, 45.5 mm slide height, 32 mm system compatibility and 18 in length. Drilling remains disabled because the slide exposes multiple direct-access mounting choices."
      },
      "apply": {
        "drawer_mount": "metal_slides",
        "metal_slide_clearance_per_side": 12.7,
        "metal_slide_length": 457.2,
        "metal_slide_front_setback": 2,
        "metal_slide_envelope_height": 45.5,
        "include_metal_slide_holes": false,
        "metal_slide_hole_pattern_mode": "legacy_spacing"
      },
      "source": {
        "type": "manufacturer_pdf",
        "manufacturer": "Knape & Vogt",
        "title": "8400 Full Extension Box or File Drawer Slide / installation instructions",
        "url": "https://knapeandvogt.com/sites/default/files/300834-0708-8400Installation%20sheet.pdf",
        "retrieved": "2026-09-15"
      }
    },
    {
      "id": "kv_8400_20in",
      "extends": "kv_8400_18in",
      "label": "KV 8400 20 in (508 mm)",
      "model": "8400 20 in",
      "apply": {
        "metal_slide_length": 508
      }
    },
    {
      "id": "hettich_ka5632_450",
      "category": "drawer_slide",
      "manufacturer": "Hettich",
      "family": "KA 5632",
      "model": "1073724",
      "label": "Hettich KA 5632 450 mm",
      "targets": [
        "utility",
        "shop_cart",
        "benchtop",
        "stackable",
        "kitchen",
        "drawer"
      ],
      "verification": {
        "status": "manufacturer_partial",
        "verified": true,
        "notes": "Manufacturer product data verifies 450 mm length and 46 x 12.7 mm section. Drilling is disabled until a specific mounting-hole choice is encoded."
      },
      "apply": {
        "drawer_mount": "metal_slides",
        "metal_slide_clearance_per_side": 12.7,
        "metal_slide_length": 450,
        "metal_slide_front_setback": 0,
        "metal_slide_envelope_height": 46,
        "include_metal_slide_holes": false,
        "metal_slide_hole_pattern_mode": "legacy_spacing"
      },
      "source": {
        "type": "manufacturer_web",
        "manufacturer": "Hettich",
        "title": "KA 5632 ball bearing runner 450 mm",
        "url": "https://shop.hettich.com/us_EN/Runner-systems/Ball-bearing-runners/Side-installation/KA-5632-ball-bearing-runner%2C-side-installation%2C-dimensions-%28H-x-W%29-46-x-12-7-mm%2C-450-mm%2C-black/p/1073724",
        "retrieved": "2026-09-15"
      }
    },
    {
      "id": "hettich_ka5632_500",
      "extends": "hettich_ka5632_450",
      "label": "Hettich KA 5632 500 mm",
      "model": "1073725",
      "apply": {
        "metal_slide_length": 500
      },
      "source": {
        "type": "manufacturer_web",
        "manufacturer": "Hettich",
        "title": "KA 5632 ball bearing runner 500 mm",
        "url": "https://shop.hettich.com/us_EN/Runner-systems/Ball-bearing-runners/Side-installation/KA-5632-ball-bearing-runner%2C-side-installation%2C-dimensions-%28H-x-W%29-46-x-12-7-mm%2C-500-mm%2C-black/p/1073725",
        "retrieved": "2026-09-15"
      }
    },
    {
      "id": "generic_euro_35_110_overlay",
      "category": "hinge",
      "manufacturer": "Generic",
      "family": "35 mm concealed hinge",
      "model": "110 degree overlay",
      "label": "Generic Euro 35 mm / overlay",
      "targets": [
        "utility",
        "shop_cart",
        "stackable",
        "kitchen"
      ],
      "verification": {
        "status": "reference",
        "verified": false,
        "notes": "Generic baseline; verify exact hinge and plate."
      },
      "apply": {
        "hinge_style": "euro_35mm",
        "front_mount_style": "overlay",
        "hinge_cup_diameter": 35,
        "hinge_cup_depth": 12,
        "hinge_cup_center_from_door_edge": 22.5,
        "hinge_door_fixing_hole_diameter": 3,
        "hinge_door_fixing_hole_spacing": 45,
        "hinge_plate_hole_diameter": 5,
        "hinge_plate_center_from_front": 37,
        "hinge_plate_hole_spacing": 32,
        "hinge_door_fixing_enabled": true,
        "hinge_plate_holes_enabled": true
      },
      "source": {
        "type": "project_reference",
        "title": "Modular Storage generic Euro-hinge baseline"
      }
    },
    {
      "id": "generic_euro_35_110_inset",
      "extends": "generic_euro_35_110_overlay",
      "label": "Generic Euro 35 mm / inset",
      "model": "110 degree inset",
      "apply": {
        "front_mount_style": "inset_flush"
      }
    },
    {
      "id": "blum_clip_top_blumotion_110_overlay_reference",
      "category": "hinge",
      "manufacturer": "Blum",
      "family": "CLIP top BLUMOTION",
      "model": "110 degree reference",
      "label": "Blum CLIP top BLUMOTION 110\u00b0 / overlay reference",
      "targets": [
        "utility",
        "shop_cart",
        "stackable",
        "kitchen"
      ],
      "verification": {
        "status": "manufacturer_partial",
        "verified": true,
        "notes": "35 mm cup, 13 mm boring depth and 37/32 mounting-plate reference are manufacturer-based. Door fixing is disabled because attachment variants differ; cup center uses a 5 mm K reference and should be checked for the chosen application."
      },
      "apply": {
        "hinge_style": "euro_35mm",
        "front_mount_style": "overlay",
        "hinge_cup_diameter": 35,
        "hinge_cup_depth": 13,
        "hinge_cup_center_from_door_edge": 22.5,
        "hinge_door_fixing_enabled": false,
        "hinge_plate_hole_diameter": 5,
        "hinge_plate_center_from_front": 37,
        "hinge_plate_hole_spacing": 32,
        "hinge_plate_holes_enabled": true
      },
      "source": {
        "type": "manufacturer_web",
        "manufacturer": "Blum",